leela-zero-0.12_win/leelaz_opencl_tuning
0;XgemmBatched;192;100;192;16; -DKWG=32 -DKWI=2 -DMDIMA=16 -DMDIMC=16 -DMWG=64 -DNDIMB=8 -DNDIMC=8 -DNWG=64 -DSA=1 -DSB=1 -DSTRM=0 -DSTRN=0 -DVWM=4 -DVWN=4;OpenCL: Intel(R) Corporation Intel(R) HD Graphics 530 @ 1150MHz
0;XgemmBatched;256;100;256;16; -DKWG=32 -DKWI=2 -DMDIMA=16 -DMDIMC=16 -DMWG=64 -DNDIMB=8 -DNDIMC=8 -DNWG=64 -DSA=1 -DSB=1 -DSTRM=0 -DSTRN=0 -DVWM=4 -DVWN=4;OpenCL: Intel(R) Corporation Intel(R) HD Graphics 530 @ 1150MHz
